id	title	author	date	a	b	c	d	e
341547	Memoirs of the Marquis de St. Forlaix. Translated from the French of Mons. Framery. By Mrs. Brooke. [epigraph]. Vol. I.	Framery, Nicolas Etienne	1770	['Translation']	['Title Page', 'Preface']	['French']		['Translated from the French of Mons. Framery by Mrs. Brooke']
341564	The modern Atalantis; or, the devil in an air balloon. Containing the characters and secret memoirs of the most conspicuous persons of high quality, of both sexes, in the island of Libertusia, in the western ocean. Translated from the Libertusian language.		1784	['Translation']	['Title Page']	['Libertusian']		['Translated from the Libertusian language.']
341574	New idylles by Gessner. Translated by W. Hooper MD. With a letter to M. Fuslin on landscape painting, and the two friends of Bourbon, a moral tale, by M. Diderot.	Gessner, Salomon	1776	['Translation']	['Title Page']			['Translated by W. Hooper MD.']
341601	The paths of virtue delineated; or, the history in miniature of the celebrated Pamela, Clarissa Harlowe, and Sir Charles Grandison. [epigraph]. The second edition.		1773	['Adaptation']	['Preface']			['The following work consists of miniatures, taken with as much care as possible, from those large pictures of human life; and it is hoped, that none will be so unjust, as to imagine, that this is done with a design to injure the beautiful originals.', "Adapted from Samuel Richardson's Pamela, Clarissa, and Sir Charles Grandison"]
341604	The phoenix; or, the history of Polyarchus and Argenis. Translated from the Latin, by a lady. In four volumes. Volume I.	Barclay, John	1772	['Translation']	['Title Page']	['Latin']		['Translated from the original Latin, by a lady.']
341606	The shipwreck and adventures of Monsieur Pierre Viaud, a native of Bourdeaux, and captain of a ship. Translated from the French, by Mrs. Griffith.	Dubois-Fontanelle, Jean Gaspard	1771	['Translation']	['Preface, by the translator']	['French']		['Preface, by the translator.']
341613	Prince Arthur: an allegorical romance. The story from Spenser. In two volumes. Vol. I.	Bicknell, Alexander	1779	['Adaptation']	['Introduction']			["...I have...devised how to make the excellencies of it [the Faerie Queene] more generally known, and to render the moral precepts contained in it universally instructive. I have chosen the following mode, which I hope will answer this purpose; preserving as many of the beauties as possible, and keeping as near the original as the different nature of a poem, and a story in prose, will allow. The loss of the last books of Spenser's work, obliging me to lengthen out the story, and to make considerable alterations throughout the whole, to preserve a proper uniformity, and to bring it to a regular conclusion."]
341618	The recess; or, a tale of other times. By the author of The chapter of accidents.	Lee, Sophia	1783	['Adaptation']	['Advertisement']			["I make no apology for adapting the language to the present times, since that of the author's would be frequently unintelligible."]
341626	Rosara; or, the adventures of an actress: a story from real life. Translated from the Italian of Pietro Chiari. Vol. II.	Chiari, Pietro	1771	['Translation']	['Title Page']	['Italian']		['Translated from the Italian of Pietro Chiari.']
341654	The sopha: a moral tale. Translated from the French of Monsieur Crebillon. A new edition. Vol. I.	CrÈbillon, Claude-Prosper Jolyot de	1781	['Translation']	['Title Page']	['French']		['Translated from the French of Monsieur Crebillon.']
341658	The sorrows of Werter: a German story. The second edition. Vol. I.	Goethe, Johann Wolfgang von	1780	['Translation']	['Preface']	['German']		['It went through several editions in German, and soon made its way into France...[The English translator] translated some of the letters from French...and as no translation from the German has hitherto appeared, it is now offered to the public.']
341695	Una and Arthur, an allegorical history: the incidents from Spenser. In two volumes. Vol. I.		1779	['Adaptation']	['Introduction']			['I have often devised how to make the excellencies of [Spenser\'s ""Fairy Queen""] more generally known, and to render the moral precepts contained in it universally instructive. I have chosen the following mode [the novel], which I hope will answer this purpose; preserving as many of the beauties as possible, and keeping as near the original as the different nature of a poem, and a story in prose, will allow."']
341703	Usong. An eastern narrative. Written in German by Baron Haller. In two volumes. Vol. I.	Haller, Albrecht von	1772	['Translation']	['Title Page']	['German']		['Written in German by Baron Haller...Printed for the translator']
379651	Le taureau blanc: or, the white bull. From the French. Translated from the Syriac, by M. De Voltaire. The second edition.	Voltaire	1774	['Translation']	['Title page']	['Syriac']	['French']	['From the French. Translated from the Syriac by M. De Voltaire.']
379665	The hermit of the rock: or the history of marchioness de Lausanne, and the Comte de Luzy. Translated from a French manuscript. In three volumes. Vol. I.		1779	['Translation']	['Dedication']	['French']		['In a convent in Paris where I was educated -- a friend of mine determined to try her hand in this species of writing -- never intending that it should be made public. -- When it was finished, she presented it to me -- and I find myself now, by the most unfortunate of events, at libery to publish it without giving offence to the amiable and beloved writer of it.']
380195	Chinese letters. Being a philosophical, historical, and critical correspondence between a Chinese traveller at Paris, and his countrymean in China, Muscovy, Persia and Japan. Translated from the originals into French, by the Marquis d'Argens, author of the Lettres luives, or Jewish Spy; and now done into English.	Argens, Jean-Baptiste de Boyer	1741	['Translation']	['Title page']	['French']	['Chinese']	["Translated from the originals into French, by the Marquis d'Argens"]
380529	The court-secret: a melancholy truth. Now first translated from the original Arabic. By an adept in the oriental tongues.	Lyttelton, George Lyttelton	1741	['Translation']	['Title page']	['Arabic']		['Now first translated from the original Arabic. By an adept in the oriental tongues.']
380552	The history and adventures of Don Alphonso Blas de Lirias, son of Gil Blas of Santillane: translated from the Spanish original.		1741	['Translation']	['Title page']	['Spanish']		['Translated from the Spanish original.']
440184	The lives of Cleopatra and Octavia. By the author of David Simple.	Fielding, Sarah	1757	['Author (text)']	['Reference to other works']	['By the author of David Simple.']	['Title Page']	['Indeterminate']
440188	The cloister: or, the amours of Sainfroid, a Jesuit, and Eulalia, a nun. Translated from the French.		1758	['Translation']	['Title page']	['French']		['Translated from the French']
440196	The dreamer. 	King, William	1754	['Adaptation']	['Advertisement']	['Dream Language']		['...What was the work? Who was the author? &c. I answered, it was no work, but a dream: and as to the author, or dreamer, he was as little known to me... The learned professor took up the sheets...of which he offered to give me a solution or interpretation... Upon which he sat down and wrote what follows...']
440197	The Dreamer.	King, William	1754	['Adaptation']	['Advertisement']	['Dream Language']		['...What was the work? Who was the author? &c. I answered, it was no work, but a dream: and as to the author, or dreamer, he was as little known to me... The learned professor took up the sheets...of which he offered to give me a solution or interpretation... Upon which he sat down and wrote what follows...']
440200	The fortunate villager: or, memoirs of Sir Andrew Thompson. In two volumes. Vol. I. 	Bannac, Adolphus	1750	['Translation']	['Preface']	['French']		['I am now to inform the reader that the following work is a translation from the Paysan Parvenu of Monsieur de Marivaux; but as we are less apt to be affected with events happening at a distance, than when they are brought home to us, I have ventured to change the scene of action from Paris to London; and the names of the several personages who fill the drama, which in the original are truly French, into downright English.']
440231	The fortunate country maid. Being the entertaining memoirs of the present celebrated Marchioness of L---- V----: Who, from a cottage, through a great variety of diverting adventures, became a lady of the first quality in the court of France, by her stready adherence to the principles of virtue and honour. Wherin are display'd the various and vile artifices employ'd by men of intrigue for seducing young women. With suitable reflections. From the French of Chevalier de Mouhy. Vol. II. The Fifth Edition. Corrected. 	Mouhy, Charles de Fieux	1758	['Translation']	['Title Page']	['French']		['From the French of the Chevalier de Mouhy.']
440235	Letters from an old man to a young prince, with the answers. Translated from the Swedish. To which are prefixed those of her present Majesty to her son: with the translations. In two volumes. Vol. I.	Tessin, Carl Gustaf	1756	['Translation']	['Title page']	['French']		['[Letters] of her present Majesty to her Son : with the Translations']
440239	Letters of Princess Zilia, to Prince Aza of Peru, newly translated from the French original. By James Seguin, teacher of the French tongue in Hereford. 	Garfigny,	1775	['Translation']	["The Editor's Advertisment"]	['Unknown']		['It seems needless to give notice, that the first letters of Zilia, were translated by herself, every one must easily judge that, being composed in a language, and traced in a manner equally unknown to us; this collection could not never have reached us, if the same hand had not wrote them in our tongue.']
440267	A narrative of the life of Mrs. Charlotte Charke, (youngest daughter of Colley Cibber, Esq;) containing, I. An account of her birth, education, and mad pranks committed in her youth. II. Her coming on the stage; Success there; and sundry theatrical anecdotes. III. Her marriage to Mr. Charke, and its consequences. IV. Her adventures in mens cloaths, going by the name of Mr. Brown, and being belov'd by a lady of great fortune, who intended to marry her. V. Her being gentleman to a certain peer. VI. Her commencing strolling - player; with various and surprizing vicissitudes of fortune, during nine years peregrination. VII. Her turning pastry cook, &c. in Wales. With several extremely humourous and interesting occurrences. Written by herself. 	Charke, Charlotte	1755	['Author (text)']	['Proper name']	['A narrative of the life of Mrs. Charlotte Charke.... Written by herself.']	['Title page']	['Female']
440270	The empire of the Nairs; or, the rights of women. An utopian romance, in twelve books. By James Lawrence, author of The bosom friend, Love, an allegory, etc. In four volumes. Vol. I. Second edition.	Lawrence, James	1813	['Translation']	['Advertisement']	['German']		['The author of this work being in Germany in 1793, communicated his essay on the Nair system to the celebrated Wieland...Notwithstanding the flattering manner in which this work has been recieved on the continent, the author has been continually revising it; but having lately heard that a man of letters has not only translated it into English, but has already delivered his manuscript to a bookseller, he feels the neccesity of not longer delaying this publication, which, whatever may be its success, must be more acceptable to the public than a literal translation of the first German edition.']
440287	The theory or system of several new inhabited worlds, lately discover'd and pleasantly describ'd, in five nights conversation with Madam the Marchioness of *****. Written in French by the famous Mons. Fontanelle. Made English by Mrs. Behn.	Behn, Aphra	1700	['Translation']	['Title page']	['French']		['Written in French by the famous Mons. Fontanelle. Made English by Mrs. Behn.']
440290	A few days in Athens, being the translation of a Greek manuscript discovered in Herculaneum. By Frances Wright, author of ""views of society and manners in America.""	Wright, Frances,	1822	['Translation']	['To the Reader']	['English', 'French']	['Greek']	['A MS. copy was transmitted to me in Paris, with a request that I would forthwith see it translated into the English and French languages.']
440291	Abdeker, or, The art of preserving beauty : translated from an Arabic manuscript	Le Camus, Antoine	1754	['Translation']	['Preface']	['Arabic']		['The following is a translation of an Arabian manuscript, which Diamantes Utasto, physician to the Turkish ambassador, brought to Paris in the year 1740.']
440305	Elizabeth, or, the exiles of Siberia, translated by Mrs. Meeke.  	Cottin, Madame (Sophie),	1814	['Translation']	['Title page']	['French']		['From the French of Madame de Cottin.']
440307	Friendship in death; in twenty letters from the dead to the living. To which are added, letters moral and entertaining, in prose and verse. In three parts. By Mrs. Elizabeth Rowe.	Rowe, Elizabeth Singer	1750	['Translation']	['Text']	['French']		['Translated from the moral essays of Messieurs de Port-Royal']
440309		Behn, Aphra	1718					
440319	Letters from Julia, the daughter of Augustus, to Ovid. A manuscript discovered at Herculaneum. Translated from a copy of the original. To which is annexed, The lady and the sylph. A visionary tale. 		1753	['Translation']	['Title Page']			['A manuscript discovered at Herculaneum. Translated from a copy of the original.']
440325	Memoirs of the life of Parnese, a Spanish lady of vast fortune. Written by herself: shewing the irresistable force of education: with a true account of the hardships she suffered, in man's apparel, for eight years, in different countries, in the prosecution of a virtuous amour with Rockbartez; her escape from slavery with Sarpeta, her master's daughter; their flight into Persia; her accidental marriach there to Rockbartez; and return. Interspersed with the story of Beaumont and Sarpeta. Translated from the Spanish manuscript, by R. P. Gent. 	Paltock, Robert	1751	['Translation']	['Preface']	['Spanish']		['...when imagining it would be no disagreeable entertainment to my countrymen, I perfected a translation of it, as near the original as may be; saving, that the distances, I have reduced to our standard miles and leagues; and also the coins to our sterling pounds...']
440326	Memoirs of a man of pleasure, or the adventures of Versorand. Volume I. 	La Solle, Henri-Fran√ßois de,	1751	['Translation']	['Dedication']	['French']		['Translated from the French,']
440328	Memoirs of a man of pleasure, or the adventures of Versorand. Volume I. The third edition. 	La Solle, Henri-Fran√ßois de,	1751	['Translation']	['Dedication']	['French']		['Translated from the French,']
440331	The wanderings of the heart and mind: or memoirs of Mr. de Meilcour.  Translated from the French of Mr. de Crebillon the Son.	CrÈbillon, Claude-Prosper Jolyot de	1751	['Translation']	['Title page']	['French']		['From the French of Mr. de Crebillon the Son']
440332	Modern chivalry, containing the adventures of a captain, and Teague O'Regan, his servant.	Brackenridge, H. H	1825	['Adaptation']	['Postscript']			["I had originally begun this work in verse, and have a volume by me, about two parts in three as large as Bulter's Hudibrass; from which composition I have extracted this; thinking it might be more acceptable in prose. When I visit this city next, I may produce that in verse, and let the people take their choice."]
440351	The theory or system of several new inhabited worlds, lately discover'd and pleasantly describ'd, in five nights conversation with Madam the Marchioness of *****. Written in French by the famous Mons. Fontanelle. Made English by Mrs. Behn.	Behn, Aphra	1700	['Translation']	['Title page']	['French']		['Written in French by the famous Mons. Fontanelle. Made English by Mrs. Behn.']
440354	A few days in Athens, being the translation of a Greek manuscript discovered in Herculaneum. By Frances Wright, author of ""views of society and manners in America.""	Wright, Frances,	1822	['Translation']	['To the Reader']	['English', 'French']	['Greek']	['A MS. copy was transmitted to me in Paris, with a request that I would forthwith see it translated into the English and French languages.']
440355	Abdeker, or, The art of preserving beauty : translated from an Arabic manuscript	Le Camus, Antoine	1754	['Translation']	['Preface']	['Arabic']		['The following is a translation of an Arabian manuscript, which Diamantes Utasto, physician to the Turkish ambassador, brought to Paris in the year 1740.']
440369	Elizabeth, or, the exiles of Siberia, translated by Mrs. Meeke.  	Cottin, Madame (Sophie),	1814	['Translation']	['Title page']	['French']		['From the French of Madame de Cottin.']
440371	Friendship in death; in twenty letters from the dead to the living. To which are added, letters moral and entertaining, in prose and verse. In three parts. By Mrs. Elizabeth Rowe.	Rowe, Elizabeth Singer	1750	['Translation']	['Text']	['French']		['Translated from the moral essays of Messieurs de Port-Royal']
440373		Behn, Aphra	1718					
440381	Letters from Julia, the daughter of Augustus, to Ovid. A manuscript discovered at Herculaneum. Translated from a copy of the original. To which is annexed, The lady and the sylph. A visionary tale. 		1753	['Translation']	['Title Page']			['A manuscript discovered at Herculaneum. Translated from a copy of the original.']
440387	Memoirs of the life of Parnese, a Spanish lady of vast fortune. Written by herself: shewing the irresistable force of education: with a true account of the hardships she suffered, in man's apparel, for eight years, in different countries, in the prosecution of a virtuous amour with Rockbartez; her escape from slavery with Sarpeta, her master's daughter; their flight into Persia; her accidental marriach there to Rockbartez; and return. Interspersed with the story of Beaumont and Sarpeta. Translated from the Spanish manuscript, by R. P. Gent. 	Paltock, Robert	1751	['Translation']	['Preface']	['Spanish']		['...when imagining it would be no disagreeable entertainment to my countrymen, I perfected a translation of it, as near the original as may be; saving, that the distances, I have reduced to our standard miles and leagues; and also the coins to our sterling pounds...']
440388	Memoirs of a man of pleasure, or the adventures of Versorand. Volume I. 	La Solle, Henri-Fran√ßois de,	1751	['Translation']	['Dedication']	['French']		['Translated from the French,']
440390	Memoirs of a man of pleasure, or the adventures of Versorand. Volume I. The third edition. 	La Solle, Henri-Fran√ßois de,	1751	['Translation']	['Dedication']	['French']		['Translated from the French,']
440393	The wanderings of the heart and mind: or memoirs of Mr. de Meilcour.  Translated from the French of Mr. de Crebillon the Son.	CrÈbillon, Claude-Prosper Jolyot de	1751	['Translation']	['Title page']	['French']		['From the French of Mr. de Crebillon the Son']
440382	Modern chivalry, containing the adventures of a captain, and Teague O'Regan, his servant.	Brackenridge, H. H	1825	['Adaptation']	['Postscript']			["I had originally begun this work in verse, and have a volume by me, about two parts in three as large as Bulter's Hudibrass; from which composition I have extracted this; thinking it might be more acceptable in prose. When I visit this city next, I may produce that in verse, and let the people take their choice."]
440399	The life and amours of Owen Tideric Prince of Wales, otherwise Owen Tudor, who married Catharine Princess of France, and widow of our great king Henry V; from which marriage descended Henry VIII. Edward VI. Queen Mary, and Queen Elizabeth, all of whom had from him the surname of Tudor; and from him likewise are descended, by the eldest daughter of Henry VII. the present royal family of Great Britain, France, and Ireland. First wrote in French, and published many years since at Paris, and now translated into English.	Curli, de	1751	['Translation']	['Title page']	['French']		['First wrote in French, and published many years since at Paris, and now translated into English.']
440410	The adventures of Gil Blas. Translated from the French of Le Sage by Tobias Smollet, MD. Vol. I.	Le Sage, Alain-RenÈ	1809	['Translation']	['Title page']	['French']		['Translated from the french of Le Sage by T. Smollet. M.D.']
440411	The castle of otranto. a gothic story. Translated by William Marshal, gent. From the original italian of Onuphrio Muralto, canon of the church of St. Nicholas at otranto. The sixth edition.	Walpole, Horace	1791	['Translation']	['Preface']	['Italian']		["It is natural for a translator to be prejudiced in favor of his adopted work.... Yet I am not blind to my author's defects.... I hope I may be encouraged to reprint the original Italian."]
440415	The force of education. Illustrated in the memoirs of Mademoiselle de St. Eugene, and the Baron de Cromstad. Translated from the French of Monsieur de V-----.	Aunillon, Pierre-Charles-Fabiot	1751	['Translation']	['Title page']	['French']		['Translated from the French of Monsieur de V-----.']
440425		Davis, John		['Adaptation']				
1523438	The memoirs of the court of Scotland, or, the history of the Earl of Douglas ; with the secret history of Mackbeth, King of Scotland. Written by the author of The ladies travels into Spain, The memoirs of the court of England, and The memoirs of the Earl of Warwick. To which is added the Art of love; or the Amours of Count Schlick, Chancellor to the Emperor, with a young court lady ; written in Latin by Pope Pius the II.	Aulnoy	1711	['Adaptation']	['Title page']			['Taken from a very ancient original manuscript.']
155707	The loves of Othniel and Achsah. Translated from the Chaldee. Volume the first.	Tooke, William	1769	['Translation']	['Title Page']	['Chaldee']		['""Translated from the Chaldee.""']
1623886	The memoirs of Capt. John Creichton. From his own materials, drawn up and digested by Jonathan Swift, D.D. D.S.P.D. First printed in the year, 1731.	Creichton, John	1768	['Adaptation']	['Advertisement']			['""The Captain, soon after, waited on the Dean with his papers, and related many adventures to him; which the Dean was so kind as to put in order of time, to correct the style, and make a small book of, intitled, The Memoirs of Captain John Creichton."']
179309	The adventures of Sig. Gaudentio di Lucca. Being the substance of his examination before the fathers of the Inquisition at Bologna in Italy : giving an account of an unknown country in the midst of the deserts of Africa, the origin and antiquity of the people, their religion, customs, and laws. Copied from the original manuscript in St. Mark's Library at Venice; with critical notes of the learned Signor Rhedi. To which is prefixed a letter of the secretary of the Inquisition, shewing the reasons of Signor Gaudentio's being apprehended, and the manner of it. Translated from the Italian.	Berington, Simon	1763	['Translation']	['Title page']	['Italian']		['Translated from the Italian.']
1798963	Tales translated from the Persian Inatulla of Delhi. In two volumes. Vol. 1.	InaÃÑyat AllaÃÑh	1768	['Translation']	['Title page']	['Persian']		['""Translated from the Persian of Inatulla of Delhi."']
1799792	The Spanish politician: or, Some account of the management of Cardinal Alberoni. Done out of French.		1718	['Translation']	['Title page']	['French']		['Done out of French.']
1801901	The bonze, or Chinese anchorite, an oriental epic novel. Translated from the Mandarin language, of Hoamchi-vam, a Tartarian proselite, by Monsr. D'Alenzon, dedicated to Lord Kilwarling son and heir of the Earl of Hilliborough Secretary of State for the Northern colonies. With adventurous wing exploring new-found worlds, the orient muse unfettered with rhyme who sings of heaven, of earth, and wond'rous mutations: strives to mingle instruction with delight, in hope to gain the smile of approbation. Vol. I.		1769	['Translation']	['Title page']	['Mandarin']		['Translated from the Mandarin language']
1818524	Persian Letters. Translated by Mr. Ozell. The third edition.	Montesquieu, Charles de Secondat	1731	['Translation']	['Advertisement']	['French']	['French']	['“If ever the translation of a French book was necessary in a country where the language is so much understood as in England, it is this, which in many places is so obscure, that tho’ I think I have had a tolerable experience in this tongue, yet without much thought and even sometimes consulting of friends, I own I could not have reached this sense.']
1818538	The life of the Countess de Gondez. Written by her own hand in French, and dedicated to the Princess de la Roche-sur-yon. And now faithfully translated into English, by Mrs. P. Aubin.	Lussan, Marguerite de	1729	['Translation']	['Title page']	['French']		['Written by her own hand in French, and dedicated to the Princess de la Roche-sur-yon. And now faithfully translated into English, by Mrs. P. Aubin.']
191356	Letters from Juliet Lady Catesby, to her friend, Lady Henrietta Campley. Translated from the French.	Riccoboni, Marie Jeanne	1760	['Translation']	['Title Page']	['French']		['Translated from the French']
196998	L'ingenu; or the sincere Huron: a true history. Translated from the French of M. De Voltaire.	Voltaire	1768	['Translation']	['Title page']	['French']		['Translated from the French of M. De Voltaire.']
197114	Letters from Juliet Lady Catesby, to her friend Lady Henrietta Campley. Translated from the French. The third edition.	Riccoboni, Marie Jeanne	1763	['Translation']	['Title page']	['French']		['Translated from the French']
