id	title	author	date	a	b	2	3	5	6	7
191125	Dialogues of the dead.	Lyttelton, George Lyttelton	1760	['Author (text)']	['Generic/Descriptive']	['The three last dialogues are written by a different hand; as I am afraid would have appeared but too plainly to the Reader without my having told it.']	['Preface']	['Indeterminate']	['Female']	['Elizabeth Montagu has been identified as the author of the last three dialogues.']
192859	Almoran and Hamet: an oriental tale. In two volumes. Volume first.	Hawkesworth, John	1761	['Author (paratext)']	['Proper name']	['John Hawkesworth']	['Dedication']	['Male']	['Male']	
192863	Almoran and Hamet: an oriental tale. In two volumes. The second edition. Vol. I.	Hawkesworth, John	1761	['Author (paratext)', 'Author (text)']	['Proper name']	['John Hawkesworth']	['Dedication']	['Male']	['Male']	['Hawkesworth signs the dedication and implies that he wrote the text.']
193273	The adventures of a black coat. Containing a series of remarkable occurrences and entertaining incidents, that it was a witness to in its peregrinations through the cities of London and Westminster, in company with variety of characters. As related by itself. Qui mores hominum multorum vidit. Hor.		1760	['Author (text)', 'Author (paratext)']	['Generic/Descriptive']	['""I have endeavored to make the author less conspicuous than the moral.""']	['Preface']	['Indeterminate"']		
193280	The adventures of of David Simple: containing an account of his travels through the cities of London and Westminister, in the search of a real friend. By a lady. In two volumes.	Fielding, Sarah	1761	['Author (text)']	['Generic/Descriptive']	['By a Lady.']	['Title Page (both vols)']		['Female']	
193355	Chrysal: or, the adventures of a guinea. Wherein are exhibited views of several striking scenes, with curious and interesting anecdotes, of the most noted persons in every rank of life, whose hands it passed through, in America, England, Holland, Germany, and Portugal. By an adept. The sixth edition, greatly inlarged and corrected. Vol. I.	Johnstone, Charles	1767	['Editor (text)']	['Generic/Descriptive']	['""The very favorable reception, which the former edition of this work, mutilated and imperfect as it was, met with from the public, has encouraged the editor to use every possible means, for the recovery of the rest of the manuscript.""']	['Advertisement (v.1)']	['Male']	['Male']	['Claims this manuscript was found. This claim is ludicrous; advertisement most likely authored by Charles Johnstone."']
193485-1	Polly Honeycombe, a dramatick novel of one act. As it is now acted at the Theatre-Royal in Drury-Lane.	Colman, George	1760	['Author (text)']	['Generic/Descriptive']	['""Now for our Author! ...[this text] is the first folly of a simple Youth""']	['Prologue']	['Indeterminate']	['Male']	['The Prologue asks the audience for a generous reception: ""Exert your favour to a young Beginner, --- Nor use this Stripling like a Batter\'d Sinner!"']
193485-2	Polly Honeycombe, a dramatick novel of one act. As it is now acted at the Theatre-Royal in Drury-Lane.	Colman, George	1760	['Author (text)']	['Generic/Descriptive']	['""Now for our Author! ...[this text] is the first folly of a simple Youth""']	['Prologue']	['Indeterminate']	['Male']	['The Prologue asks the audience for a generous reception: ""Exert your favour to a young Beginner, --- Nor use this Stripling like a Batter\'d Sinner!"']
193485_3	Polly Honeycombe, a dramatick novel of one act. As it is now acted at the Theatre-Royal in Drury-Lane.	Colman, George	1760	['Author (paratext)']	['Proper name']	['Epilogue']		['Male"']		
193494	The adventures of Sir Launcelot Greaves. By the author of Roderick Random. In two volumes. Vol. 1.	Smollett, Tobias George	1762	['Author (text)']	['Reference to other works']	['By the author of Roderick Random.']	['Title Page']	['Indeterminate']	['Male']	
193580-1	The histories of Lady Frances S----, and Lady Caroline S----. Written by the Miss Minifies, of Fairwater, in Somersetshire. Vol. I.	Gunning	1763	['Author (paratext)']	['Proper name']	["Your ladyship's obliged and obedient humble servants, M.M.S. Minifie."]	['Dedication']	['Female']	['Female']	
194294	The Adventures of Sylvia Hughes. Written by herself.		1761	['Author (text)']	['Proper name']	['""Your Ladyship\'s most obedient servant, Sylvia Hughes.""']	['Preface']	['Female']	['Unknown"']	
194528	Travels through France and Italy. Containing observations on character, customs, religion, government, police, commerce, arts, and antiquities. With a particular description of the town, territory, and climate of Nice: to which is added, a register of the weather, kept during a residence of eighteen months in that city. By T. Smollett, M.D. In two volumes. Vol. I.	Smollett, Tobias George	1766	['Author (text)']	['Proper name']	['""By T. Smollett, M.D.""']	['Title Page']	['Male']	['Male"']	
194769	The wanderer: or, memoirs of Charle Searle, Esq; containing his adventures by sea and land. With many remarkable characters, and interesting situations in real life; and a variety of surprizing incidents. In two volumes. Vol. I.		1766	['Editor (text)']	['Generic/Descriptive']	['The editor']	['Preface']	['Male']		
194812	The history of Lady Julia Mandeville. In two volumes. By the translator of Lady Catesby's letters. The fourth edition. Vol I.	Brooke, Frances	1765	['Author (text)']	['Reference to other works']	["By the translator of Lady Catesby's Letters."]	['Title Page']		['Female']	
194813	The history of Lady Julia Mandeville. In two volumes. By the translator of Lady Catesby's letters. The third edition. Vol I.	Brooke, Frances	1764	['Author (text)']	['Reference to other works']	["By the translator of Lady Catesby's Letters."]	['Title Page']		['Female']	
196219-1	The history of Emily Montague. In four volumes. By the author of Lady Julia Mandeville. Vol. I.	Brooke, Frances	1769	['Author (paratext)']	['Proper name']	['I am, with the utmost esteem and respect, your most obedient servent, Frances Brooke.']	['Dedication']	['Indeterminate']	['Female']	
196219-2	The history of Emily Montague. In four volumes. By the author of Lady Julia Mandeville. Vol. I.	Brooke, Frances	1769	['Author (paratext)']	['Proper name']	['I am, with the utmost esteem and respect, your most obedient servent, Frances Brooke.']	['Dedication']	['Female']	['Female']	
196603-2	The discovery: or, memoirs of Miss Marianne Middleton. By Mrs. Woodfin, author of Harriot Watson, Sally Sable, and of The Auction, a modern novel. In two volumes. Vol. I.	Woodfin	1764	['Author (paratext)']	['Initials']	['A. W.']	['Advertisement']	['Female']	['Female']	['Woodfin signs preface ""A.W."" and notes that she is ""in her sixtieth year."']
196603	The discovery: or, memoirs of Miss Marianne Middleton. By Mrs. Woodfin, Author of Harriot Watson, Sally Sable, and of The auction, a modern novel. In two volumes.	Woodfin	1764	['Author (text)']	['Reference to other works', 'Proper name']	['By Mrs. Woodfin, Author of Harriot Watson, Sally Sable, and of The Auction, a modern novel.']	['Title Page of both volumes']	['Female']	['Female']	
196689	Letters on different subjects, in four volumes; amongst which are interspers'd the adventures of Alphonso, after the destruction of Lisbon. By the author of The unfortunate mother's advice to her absent daughters. The third edition. Vol. I.	Pennington, Sarah	1766	['Author (text)']	['Reference to other works']	["By the author of The unfortunate mother's advice to her absent daughters."]	['Title Page']	['Indeterminate']	['Female']	['Written by Sarah Pennington.']
196691	A series of genuine letters between Henry and Frances. The third edition, revised, corrected, enlarged, and improved, by the authors. Vol. I.	Griffith, Richard	1767	['Author (paratext)']		['Proper name']	['I am, ladies, with great respect, and esteem, your most humble, and obedient servant, Frances.""']	['Female']	['Female']	['Again the problem of intertextuality surfaces here: is this written by the fictional Frances or by the real Elizabeth Griffith?"']
1967107	Memoirs of the Chevalier Pierpoint. In two volumes. Volume the first.		1763	['Author (text)']	['Proper name']	['Memoirs of the Chevalier Pierpoint.']	['Title Page']	['Male']		['Chevalier Pierpoint is likely a fictional character.']
196864	The history of Miss Pittborough. In a series of letters. By a lady. In two volumes.	A Lady	1767	['Author (text)']	['Generic/Descriptive']	['By a lady']	['Title Page of v.1']	['Female']		
196998	L'ingenu; or the sincere Huron: a true history. Translated from the French of M. De Voltaire.	Voltaire	1768	['Author (text)']	['Proper name']	['Translated from the French of M. De Voltaire.']	['Title Page']	['Male']	['Male']	
197053	The history of Nourjahad. By the editor of Sidney Bidulph.	Sheridan, Frances Chamberlaine	1767	['Author (text)']	['Reference to other works']	['""By the editor of Sidney Bidulph""']	['Title Page']	['Indeterminate']	['Female"']	
197114	Letters from Juliet Lady Catesby, to her friend Lady Henrietta Campley. Translated from the French. The third edition.	Riccoboni, Marie Jeanne	1763	['Juliet Lady Catesby']	['Proper name']	['Letters from Lady Juliet Catesby to her friend Lady Henrietta Campley']	['Title Page']	['Female']		
197294-1	The history of Eliza. Written by a friend. In two volumes. Vol. I.	Friend	1767	['Author (text)']	['Generic/Descriptive']	['""The History of Eliza is a narrative of facts, which gives the relator no claim to the merit of invention; if the public is pleased with her manner of relating them, her expectations will be more than answered.""']	['To the reader']	['Female"']		
197294-2	The history of Eliza. Written by a friend. Vol. I.	Friend	1767	['Author (paratext)']	['Generic/Descriptive']	['""The writer of the following sheets was prevailed upon to make them public...""']	['To the reader']	['Indeterminate']	['Unknown"']	
197297-1		Longueville, Peter	1768	['Author (text)']	['Proper name']	["...The second and third books were faithfully transcribed from Mr. Quarll's parchment-role..."]	['Preface', 'Unknown']	['Male']		
197400	The lovers: or The memoirs of Lady Sarah B---- and the Countess P----. Published by Mr. Treyssac de Vergy, counsellor in the Parliament of Paris.	Treyssac de Vergy, Pierre Henri	1769	['Author (text)']	['Generic/Descriptive']	['""Of the passions, he has written with the pen of an Ovid, of the feelings, with that of Richardson.']	['To the reader']	['Male']		['Treyssec de Very, who is the real author of this book, is talking about a fictional author here (although he claims the author to be real)."']
197903	The correspondence of Theodosius and Constantia, from their first acquaintance to the departure of Theodosius. Now first published from the original manuscripts. By the editor of The letters that passed between Theodosius and Constantia, after she had taken the veil.	Langhorne, John	1765	['Author (text)']	['Reference to other works']	['By the editor of the Letters that passed between Theodosius and Constantia, after she had taken the veil.']	['Title Page']		['Male']	
197904	The history of Lady Julia Mandeville. In two volumes. By the translator of Lady Catesby's Letters. The fifth edition. Vol. I.	Brooke, Frances	1769	['Author (text)']	['Reference to other works']	["By the translator of Lady Catesby's Letters."]	['Title Page']		['Female']	
198171	The faithful fugitives: or, adventures of Miss Teresa M---. In a series of letters to a friend.		1766	['Editor (text)', 'Author (paratext)']	['Generic/Descriptive']	['""However, they may decide in this respect, if they should reap from it instruction and entertainment, it will answer the design of the benevolent author, and the editor will not think his labour ill bestowed.""']	['Preface']	['Indeterminate"']		
198261	The hermit. A novel. By a lady. In two volumes. Vol. I.	Atkyns	1769	['Author (text)']	['Generic/Descriptive']	['""By a lady.""']	['Title Page']	['Female']	['Female']	
1986497	Maria; the genuine memoirs of a young lady of rank and fortune. By the author of The life and adventures of Joe Thompson. The second edition, corrected. Vol. I.	Kimber, Edward	1765	['Author (text)']	['Generic/Descriptive']	['By the author of The life and adventures of Joe Thompson.']	['Title Page']			
198707	Letters from Lothario to Penelope. To which is added Lucinda, a dramatic entertainment of three acts. Inscribed to David Garrick, Esq. In two volumes. Volume the first.	Jenner, Charles	1769	['Author (text)']	['Generic/Descriptive']	['Untaught in Roman or in Grecian schools,---An utter stranger to dramatic rules,---Our tiny bard, with bold adventurous stride,---Dares to attempt on Pegasus to ride.']	['Poem']	['Male']	['Male']	['This is an authorship claim for ""Lucinda,"" not ""Penelope."" But it is fair to assume that Lucinda, like Penelope, was written by Charles Jenner."']
198847	Two novels. In letters. From the authors of Henry and Frances. In four volumes. Volume the first.	Griffith, Richard	1769	['Author (paratext)']	['Generic/Descriptive']	['...I sat down to frame a preface to these volumes...and just as I was taking up the pen...I happened, most luckily for my readers, to recollect that the fame of the topic had been better handled, before, by an ingenius writer, Henry Home...so referring you to him, I shall, with becoming modesty, for the present withdraw.']	['Preface']	['Indeterminate', 'Male']		['Richard Griffith wrote The Gordian knot and is likely author of the preface to those volumes containing The Gordian knot.']
198860	Belisarius. By M. Marmontel, member of the French Academy.	Marmontel, Jean FranÁois	1767	['Author (paratext)']	['Generic/Descriptive']	["The translator's preface."]	['Preface']	['Indeterminate']		
198912	The adventures of an author. Written by himself and a friend. In two volumes. Vol. I.		1767	['Author (paratext)']	['Generic/Descriptive']	['...I hope reader, gentle, or ungentle, you are satisfied with your master of the ceremonies, who, Sir Clement like, will usher you into the preference of the Author, without any farther punctilio or etiquette.']	['Introduction']	['Male']		["Identity of work's author(s) unknown."]
198960	The Virgin in Eden: or, the state of innocency. Deliver&#x2019;d byway of image and description. Presenting a nobleman, a student, and heiress, on their progress from Sodom to Canaan. With the parable of the shepherd, Zachariah, and Mary, who dwelt in thatched tenements, secluded from noise and snares. Their holy living and dying. To which are added, Pamela&#x2019;s letters, proved to be immodest romances painted in images of virtue: masquerades in disguise, that received birth now vice reigns in triumph, and swells in streams even to a deluge. In this treatise are the divine sayings of Queen Mary and Carolina in public assemblies and select companies. Taken from their own manuscripts. The decree of god appoints these records to be kept in every house, in every kingdom and state, from one generation to another, till the great fall of nature.	Povey, Charles	1767	['Author (text)']	['Proper name']	['Charles Povey, Gent.']	['Text']			['p. 119']
199030	The Memoirs of the Count of P&#x2014;; shewing at once the dreadful consequences of vice, and the happiness in being virtuous. A novel, translated from the german, by F. W. Streit, F. Ducal S. at Jena. In two volumes. Vol. I.	Pfeil, Johann Gottlob Benjamin	1767	['Author (text)']	['Generic/Descriptive']	["The fair has met no small lustre from the author's pen..."]	['Preface']	['Male']	['Male']	['Author of text is Johann Gottlob Benjamin Pfeil.']
199111	The history of Miss Harriot Fitzroy, and Miss Emilia Spencer. Written after the manner of Mr. Richardson's Clarissa, by the author of Lucinda Courtney. In two volumes. Vol. I.	Author of Lucinda Courtney	1767	['Author (text)']	['Reference to other works']	['By the author of Lucinda Courtney.']	['Title Page']	['Indeterminate', 'Indeterminate']		
199214-1	A description of Millenium Hall, and the country adjacent: together with the characters of the inhabitants, and such historical anecdotes and reflections, as may excite in the reader proper sentiments of humanity, and lead the mind to the love of virtue. By a gentleman on his travels. 	Scott, Sarah	1767	['Author (text)']	['Generic/Descriptive']	['""By a gentleman on his travels""']	['Title Page']	['Male']	['Female"']	
199451	Callistus: or, the man of fashion. And Sophronius: or, the country gentleman. In three dialogues. By Thomas Mulso, Esq;	Mulso, Thomas	1769	['Author (paratext)']	['Proper name']	['Jortin']	['To the reader']	['Male']	['Male']	["The To the reader is an excerpt from the Preface of John Jortin's Preface for Discourses Concerning the Truth of the Christian Religion, and notes that it is such."]
199564	The history of Miss Sommervile. Written by a lady. In two volumes. Vol. I.	A Lady	1769	['Author (text)']	['Generic/Descriptive']	['Written by a lady']	['Title Page']	['Female']	['Unknown']	
199576-2	The history of Miss Sommervile. Written by a lady. In two volume. Vol. I.	A Lady	1769	['Author (text)']	['Generic/Descriptive']	['Written by a lady.']	['Title Page']		['Female']	
200185	Remarks on the character and manners of the French. In a series of letters, written during a residence of twelve months at Paris and its environs. Vol. I.		1769	['Author (text)']	['Generic/Descriptive']	['I am, with great respect, Sir or Madam, your most obedient and most humble servant, the author.']	['To the reader']	['Male']	['Unknown']	
207938	The adventures of a kidnapped orphan.		1767	['Author (paratext)']	['Generic/Descriptive']	['...the editor begs leave to inform the reader, that each circumstance was verbally communicated to him... and that as such, he presents them arranged in the order, in which they occurred; having given some account of the birth, education, and disposition of his unfortunate friend, as a necessary prelude to the sequel of his affecting story.']	['Introduction']	['Male']		['Author unknown.']
218047	The life and entertaining adventures of Mr. Cleveland, natural son of Oliver Cromwell, written by himself. Giving a particular account of his unhappiness in love, marriage, friendship, &c. and his great sufferings in Europe and America. Intermixed with reflections, describing the heart of man in all its variety of passions and disguises. Also, some curious particulars of Oliver's history and amours, and several remarkable passages in the reign of King Charles II. never before made publick. In four volumes.	PreÃÅvost	1760	['Author (paratext)']	['Generic/Descriptive']	['The editor']	['Preface']	['Male']	['Unknown']	['Identity of editor unknown. Editor speaks of the ""fair sex"" and so likely is male or is using a male authorial voice."']
247080	Histoire du Prince Titi, A. R. The history of Prince Titi, a royal allegory. Translated by a lady.	Saint-Hyacinthe	1736	['Translator (text)']	['Generic/Descriptive']	['Translated by a lady.']	['Title Page']	['Female']	['Female']	['Translator is Eliza Stanley.']
247652	The bachelor of Salamanca. Or, memoirs of Don Cherubim de la Ronda in three parts. Written originally in French by Mr. le Sage; author of the devil upon two sticks, and Gil Blas. Translated by Mr. Lockman.	Le Sage, Alain-RenÈ	1737	['Author (paratext)']	['Generic/Descriptive']	['Preface by the translator']	['Preface']	['Indeterminate']	['Unknown']	
253193	The life and adventures of Pedrillo del Campo. Intermix'd with several entertaining and delightful novels. Written originally in French, by Mons. Thibault, G.D.T. From thence translated into English, by Ralph Brookes, M.D.	Thibault	1723	['Author (paratext)']	['Proper name']	['Your most humble, and most obedient servant, Ralph Brookes.']	['Dedication']	['Male']	['Male']	
2591056	Gerania: A new discovery of a little sort of people anciently discoursed of, called pygmies. With a lively description of their stature, habit, manners, buildings, knowledge, and government, being very delightful and profitable. By Joshua Barnes, of Emmanuel College, Cambridge.	Barnes, Joshua	1675	['Author (text)']	['Proper name']	['By Joshua Barnes, of Emmanuel College, Cambridge.']	['Title Page']	['Male']	['Male']	
263842_1	The travels of Cyrus. In two volumes. To which is annex'd, A discourse upon the theology and mythology of the pagans. By the Chevalier Ramsay. Vol. I.	Ramsay	1730	['Author (paratext)']	['Proper name']	['I am, &c. Freret.']	['To the author']	['Male']	['Male']	
265180	The travels of Mr. John Gulliver, son to Capt. Lemuel Gulliver. Translated from the French, by J. Lockman. Vol. I.	Desfontaines	1731	['Translator (text)']	['Proper name']	["Madam, your ladyship's most devoted humber servant, John Lockman"]	['Dedication']	['Male']		
267389	The amours of the Count de Soissons, a prince of the house of Bourbon. In a very entertaining relation of the gallantries of persons of distinction in the court of France, during the ministry of Cardinal Richlieu, which have not hitherto been accounted for. Translated from the French into English, by James Seguin, Gent. The second edition.	Claude, Isaac	1731	['Translator (text)']	['Proper name']	['Translated from the French into English, by James Seguin, Gent.']	['Title Page']	['Male']	['Unknown']	
268576	L'entretien des beaux esprits. Being the sequel to La belle assemblée containing the following novels. Viz. The amorous thief. Nature out-done by love. The happy exchange. The triumph of virtue. Generous corsair. Vol. I. Written for the entertainment of the French court, by Madam de Gomez, author of La belle assemblée.	Gomez	1734	['Author (text)']	['Proper name', 'Reference to other works']	['Written for the entertainment of the French court, by Madam de Gomez, author of La belle assemblée.']	['Title Page']	['Female']	['Female']	
272993	Memoirs of the life and adventures of Signor Rozelli at the Hague. Giving a particular account of his birth, education, slavery, monastick state, imprisonment in the Inquisition at Rome, and the different figures he has since made, as well in Italy, as in England, France, and Holland. The whole being a series of the most diverting history, and surprizing events, ever yet made publick. The third edition corrected, enlarged with an appendix of two sheets, and adorned with curious copper cutts.	Olivier	1715	['Author (text)']	['Proper name', 'Signor Rozelli']	["The author has reserv'd for another work, the public and historical events, whereof he has been witness, or in which he has had a share...That will also be made public, after we have given the world an idea of his birth, wit, genius, and principal adventures in The life of Signor Rozelli."]	['Preface']	['Male']		['Signor Rozelli is a fiction character. The work is actually by Abbé Olivier.']
301938	Exilius: or, the banish'd Roman. A new romance. In two parts: written after the manner of Telemachus, for the instruction of some young ladies of quality. By Mrs. Jane Barker.	Barker, Jane	1715	['Author (paratext)']	['Generic/Descriptive']	["The language, I hope the reader will accept as it is...But if in this, or any thing else I have fail'd, to gratify the reader's expectation, I am very ready to beg pardon, correct and amend. In the mean time, adieu."]	['Preface']	['Female']	['Female']	
3033334	The history of Prince Mirabel's infancy, rise and disgrace: with the sudden promotion of Novicius. In which are intermix'd all the intrigues, both amorous and political, relating to those memorable adventures: As also the characters of the old and new favourites of both sexes in the court of Britomartia. Collected from the memoirs of a courtier lately deceas'd.		1712	['Author (text)']	['Generic/Descriptive']	["This Virtuoso...left these memoirs in the hands of his Jatrico...who continued the remarkable passages of his life to the great revolution in the Court of Britomartia, and dying, left them to Rosserio, the Mandarine of the empire, who himself but a small time surviv'd the change."]	['Introduction']	['Male']		
3057101	John Bull still in his senses: being the third part of Law is a bottomless-pit. Printed from a manuscript found in the cabinet of the famous Sir Humphry Polesworth: and publish'd, (as well as the two former parts) by the author of the New Atlantis.	Arbuthnot, John	1712	['Author (paratext)']	['Generic/Descriptive']	["The publisher's preface"]	['Preface']	['Indeterminate']		
3057297	Law is a bottomless-pit. Exemplify'd in the case of the Lord Strutt, John Bull, Nicholas Frog, and Lewis Baboon. Who spent all they had in a law-suit. Printed from a manuscript found in the cabinet of the famous Sir Humphry Polesworth. The fourth edition.	Arbuthnot, John	1712	['Author (text)']	['Generic/Descriptive']	['Printed from a manuscript found in a cabinet of the famous Sir Humphrey Polesworth.']	['Title Page']	['Male']		
3063545	A second tale of a tub: or, the history of Robert Powel the puppet-show-man. By Thomas Burett, Esq; The second edition.	Burnet, Thomas	1715	['Author (paratext)']	['Generic/Descriptive']	["Your ladyship's humble admirer, and vassal, the author."]	['Dedication (to the Lady Majority)']	['Indeterminate']	['Male']	
3067950	The British visions: or, Isaac Bickerstaff senr; being twelve prophecies for the year 1711. Enter'd in the hall-book of the company of stationers.	Defoe, Daniel	1711	['Author (text)']	['Proper name']	['""...I say, that I the aforesaid Isaac Bickerstaff, esq: am moved, as well by astrological vision, as the especial genius of those powers, which influence human bodies to make known to the world what shall come to pass...And thus, honest reader, being nothing doubting of thy diligent attention to what I shall prophesie. I bid thee farewell.""']	['Preface']	['Male']	['Male']	['Written by Daniel Defoe."']
