id	title	author	date	a	b	2	3	5	6	7
976233	Modern chivalry: containing the adventures of captain John Farrago, and Teague Oregan, his servant. Volume I. By H. H. Brackenridge.	Brackenridge, H. H	1792	['Author (paratext)']	['Generic/Descriptive']	['I will take my revenge...by dropping my pen altogether, as I now do for the present.']	['Conclusion']	['Indeterminate']	['Male']	
101326	The fair Syrian, a novel. By the author of Mount Henneth and Barham Downs. In two volumes. Volume I.	Bage, Robert	1787	['Author (text)']	['Reference to other works']	['By the author of Mount Henneth and Barham Downs.']	['Title Page']	['Indeterminate']	['Male']	
101332	Retaliation; or, the history of Sir Edward Oswald, and Lady Frances Seymour. A novel. In a series of letters. In four volumes. Vol. I. By Mrs. Cartwright, author of the Vale of Glendor.	Cartwright, H.	1787	['Author (text)']	['Proper name', 'Reference to other works']	['By Mrs. Cartwright, author of the Vale of Glendor.']	['Title Page']	['Female']	['Female']	
101337	The romance of real life. By Charlotte Smith. In three volumes. Vol. I.	Smith, Charlotte Turner	1787	['Author (paratext)']	['Proper name']	['Charlotte Smith']	['Preface']	['Female']	['Female']	
101382	Arpasia; or, the wanderer. A novel. By the author of The nabob. In three volumes. Vol. I.	Clarke, Richard	1786	['Author (text)']	['Reference to other works']	['By the author of The nabob.']	['Title Page']	['Indeterminate']	['Male']	
101576	Theodosius and Arabella, a novel, in a series of letters, by the late Mrs. Hampden Pye. In two volumes. Vol. I.	Pye, Jael Henrietta	1786	['Author (text)']	['Proper name']	['By the late Mrs. Hampden Pye.']	['Title Page']	['Female']	['Female']	
102798-1	The young widow; or, the history of Cornelia Sedley, in a series of letters. Volume I.	Hayley, William	1789	['Editor (text)']	['Generic/Descriptive']	['Note by the editor.']	['Footnotes']	['Indeterminate']		['Work actually authored by John Waldie.']
102798-2	The young widow; or, the history of Cornelia Sedley, in a series of letters. Volume I.	Hayley, William	1789	['Editor (text)']	['Generic/Descriptive']	['Note by the editor.']	['Footnotes']	['Indeterminate']		['Work actually authored by John Waldie.']
105725-1	The exiles; or, memoirs of the Count de Cronstadt. By Clara Reeve, author of The old English baron, Two mentors, &c. &c. In three volumes. Vol. I.	Reeve, Clara	1788	['Author (paratext)']	['Generic/Descriptive']	['The author thinks it very probable that the judicious reader will discern many defects and inequalities in the work before him; she is desirous to bespeak his candour and allowane for them, by relating the circumstances that gave birth to it.']	['Preface']	['Female']	['Female']	
105725-2	The exiles; or, memoirs of the Count de Cronstadt. By Clara Reeve,              author of The old English baron, Two mentors, &c. &c. In three volumes. Vol.              I.	Reeve, Clara	1788	['Author (paratext)']	['Generic/Descriptive']	['The author thinks it very probable that the judicious reader will              discern many defects and inequalities in the work before him; she is desirous to bespeak              his candour and allowane for them, by relating the circumstances that gave birth to              it.']	['Preface']	['Female']	['Female']	
105725-3	The exiles; or, memoirs of the Count de Cronstadt. By Clara Reeve, author of The old English baron, Two mentors, &c. &c. In three volumes. Vol. I.	Reeve, Clara	1788	['Author (paratext)']	['Generic/Descriptive']	['The author thinks it very probable that the judicious reader will discern many defects and inequalities in the work before him; she is desirous to bespeak his candour and allowane for them, by relating the circumstances that gave birth to it.']	['Preface']	['Female']	['Female']	
105744	The history of Captain and Miss Rivers. In three volumes. Vol. I.		1787	['Author (paratext)']	['Generic/Descriptive']	['I have the honour to be, my dear Madam, your most obedient, and affectionate humble servant, ******.']	['Dedication']	['Indeterminate']	['Unknown']	
105746	The history of Miss Greville. In three volumes. By the author of Interesting memoirs. Volume first.	Keir, Elizabeth	1787	['Author (paratext)']	['Generic/Descriptive']	["your ladyship's sincere friend, and obliged humble servant, The author."]	['Dedication']	['Indeterminate']	['Female']	
105788	Memoirs of Charles Townly. [Written by himself.] In three volumes. Vol. I.		1789	['Author (text)']	['Generic/Descriptive']	['Written by himself.']	['Title Page']	['Male']	['Unknown']	
105802	The man of benevolence.		1789	['Author (paratext)']	['Generic/Descriptive']	['For that purpose I have formed a story, which, I flatter myself, will inclucate virute, [...]']	['Preface']	['Male']	['Unknown']	
105881	Female stability; or, the history of Miss Belville. In a series of letters. By the late Miss Palmer. The second edition. Vol. I.	Palmer, Charlotte	1785	['Author (text)']	['Proper name']	['By the late Miss Palmer.']	['Title Page']	['Female']	['Female']	
105979	The child of woe. A novel. By Mrs. Elizabeth Norman. In three volumes. Vol. I.	Norman, Elizabeth	1789	['Author (text)']	['Proper name']	['By Mrs. Elizabeth Norman']	['Title Page']	['Female']	['Female']	
105986	Ethelinde, or the recluse of the lake. By Charlotte Smith. In five              volumes. Vol. I.	Smith, Charlotte Turner	1789	['Author (paratext)']	['Proper name']	["[signed] I have the honor to be, madam, your royal highness's most              obliged and devoted servant, Charlotte Smith."]	['Dedication']	['Female']	['Female']	
105995	Camilla; or, the correspondence of a deceased friend. In three volumes. Vol. I.		1788	['Author (text)']	['Generic/Descriptive']	['Though written in a plain stile, [the letters] have given pleasure to some friends of mine who were acquainted with the author']	['Preface']	['Female']		['Authorship claim for Camilla, most likely a fictional character.']
106006	The niece; or the history of Sukey Thornby. A novel. In three volumes. Vol. I. By Mrs. P. Gibbes, author of the history of Lady Louisa Stroud.	Gibbes, Phoebe	1788	['Author (paratext)']	['Proper name']	['P. Gibbes.']	['Preface']	['Female']	['Female']	
106010	Juliana. A novel, by the author of Francis, the philanthropist. In three volumes. Vol. I.	Johnson	1786	['Author (paratext)']	['Generic/Descriptive']	['Madam, your most obedient, and most humble servant, the author.']	['Dedication']	['Indeterminate']	['Female']	
106014-1	The Recess; or, a tale of other times. By the author of the Chapter of Accidents. The third edition, corrected. Vol. I.	Lee, Sophia	1787	['Author (paratext)']	['Proper name']	['Your highly obliged, humble servant, Sophia Lee.']	['Dedication']	['Female']	['Female']	
106014-2	The recess; or, a tale of other times. By the author of The chapter of accidents. The third edition, corrected. Vol. I.	Lee, Sophia	1787	['Author (text)']	['Proper name']	['[signed] Sir, your highly obliged, humble servant, Sophia Lee.']	['Dedication']	['Female']	['Female']	['From dedication to Sir John Eliot.']
106016	Retribution: a novel. By the author of the Gamesters, &c. In three volumes. Vol. I.	Mackenzie, Anna Maria	1788	['Author (text)']	['Reference to other works']	['By the author of the Gamesters, &c.']	['Title Page']	['Indeterminate']	['Female']	
106033	Cecilia, or memoirs of an heiress. By the author of Evelina. The fourth edition. In five volumes. Vol. I.	Burney, Fanny	1784	['Author (text)']	['Reference to other works', 'Generic/Descriptive']	['The indulgence shewn by the public to Evelina, which, unpatronized, unaided, and unowned, past through four editions in one year, has encouraged its author to risk this second attempt.']	['Advertisement']	['Indeterminate']	['Female']	
106298	The history of Lady Julia Mandeville. In two volumes. By the translator of Lady Catesby's Letters. A new edition. Vol. I.	Brooke, Frances	1788	['Author (text)']	['Reference to other works']	["By the translator of Lady Catesby's Letters"]	['Title Page']	['Indeterminate']	['Female']	
106552	Belinda, or, the fair fugitive. A novel. By Mrs. C--- dedicated to her grace the Duchess of Marlborough. A new edition. In two volumes. Vol. I.	C----	1789	['Author (paratext)']	['Initials']	['[signed] your most respectful and obedient servant, C---']	['Dedication']	['Female']	['Unknown']	
106616	The sorrows of the heart, a novel. In two volumes. Vol. I.	Heriot, John	1787	['Editor (text)']	['Generic/Descriptive']	['The Editor to the Reader']	['Dedication']	['Indeterminate']	['Unknown']	
106688	The history of Lady Caroline Rivers, in a series of letters. In two volumes. By Miss Elizabeth Todd. Vol. I.	Todd, Elizabeth	1788	['Author (paratext)']	['Proper name']	['Ladies, with the utmost respect, your much obliged and devoted humble servant, Eliz. Todd.']	['To the Reader']	['Female']	['Female']	
106711	The village of Martindale: a novel. In two volumes. Volume the first.	Nicholson	1787	['Author (paratext)']	['Generic/Descriptive']	["It has been the author's first attention to keep strictly within the bounds of probability; nor has he introduced a single incident...but what he hopes is satisfactorily accounted for"]	['Introduction']	['Male']	['Male']	
106811-2	Arundel. By the author of the Observer. Vol. I.	Cumberland, Richard	1789	['Author (paratext)']	['Initials']	['Thy devoted friend and servant, R.C.']	['To the Reader']	['Indeterminate']	['Male']	
107393-1	The man in the moon; or, travels into the lunar regions, by the man of the people. Vol. I	Thomson, William	1783	['Author (text)']	['Generic/Descriptive']	['By the man of the people']	['Title Page']	['Male']		['Author-claim for fictional character']
107393-2	The man in the moon; or, travels into the lunar regions, by the man of the people. Vol. I	Thomson, William	1783	['Author (text)']	['Generic/Descriptive']	['By the man of the people']	['Title Page']	['Male']		['Fictional character']
107701	Orlando and Seraphina: a Turkish story. Volume I.	Nicholson	1787	['Author (text)']	['Generic/Descriptive']	['The author makes no apology for his many variations from the historical relation which gave him the first hint of his own story.']	['Preface']	['Male']	['Male']	
107724	Death's a friend, a novel. By the author of the Bastard. &c. &c. Vol. I.	Author of the Bastard	1788	['Author (text)']	['Reference to other works']	['By the author of the Bastard, &c. &c.']	['Title Page']	['Indeterminate']	['Unknown']	
107726	The predestined wife; or, force of prejudice; a novel. In a series of letters. By the author of Edward and Sophia, Powis Castle, and Eliza Cleland. In two volumes. Vol. I.	Author of Eliza Cleland	1789	['Editor (text)']	['Generic/Descriptive']	['The editor solicited permission of their authors to give the following series of letters to the world.']	['Advertisement']	['Indeterminate']	['Unknown']	
107728	Agnes De-Courci: a domestic tale. In two volumes. Inscribed with permission to Col. Hunter. By Mrs. Bennett, author of the Welch Heiress, and Juvenile Indiscretions. Vol. I.	Bennett	1789	['Author (paratext)']	['Generic/Descriptive']	['Sir, your gratefully devoted humble servant, the author']	['Dedication']	['Female']	['Female']	
1341181	A sketch of old England, by a New-England man. In two volumes. Vol. I.	Paulding, James Kirke	1822	['Author (text)']	['Generic/Descriptive']	['Advertisement of the editor']	['Advertisement']	['Male']	['Male']	['Since the title ""editor"" of an epistolary novel implies the organization of letters, the ""editor"" of the letters is likely the author of the text"']
161049-2	The works of Henry Fielding, esq; with the life of the author. A new edition, in ten volumes. To which is now added, The fathers; or, The good-natured man. Vol. I.	Fielding, Henry	1784	['Author (text)']	['Proper name']	['By Sir Alexander Drawcansir, knt. Censor of Great-Britain.']	['Half title page for ""The Convent-garden journal""']	['Male']	['Male']	['""Sir Alexander Drawncansir"" was a pseudonym for Henry Fielding.']
161798	Caroline of Lichtfield; a novel. Translated from the French. By Thomas Holcroft. Vol. I.	Montolieu, Isabelle de	1786	['Translator (text)']	['Proper name']	['Translated from the French. By Thomas Holcroft.']	['Title Page']	['Male']	['Male']	
161806	Caroline of Lichtfield; a novel. Translated from the French. By Thomas Holcroft. The second edition. Vol. I.	Montolieu, Isabelle de	1786	['Translator (text)']	['Proper name']	['Translated from the French. By Thomas Holcroft.']	['Title Page']	['Male']	['Male']	
162466	The gamesters: a novel. In two volumes. By the authoress of Burton-Wood and Joseph. Vol. I.	Mackenzie, Anna Maria	1786	['Author (text)']	['Generic/Descriptive']	['The authoress presumes to hope she may stand excused [...]']	['Advertisement']	['Female']	['Female']	
162702	Warbeck: a pathetic tale. In two volumes. Vol. I.	Arnaud, FrancÃßois-Thomas-Marie de Baculard d\'	1786	['Author (paratext)']	['Generic/Descriptive']	['I have however endeavoured to owe as little as possible to my predecessor']	['Introduction']	['Indeterminate']	['Male']	
163856	The letters of Charlotte, during her connexion with Werter. Vol. I.	James, William	1786	['Author (text)']	['Proper name']	['It afforded me [the editor] no small pleasure to find, that in the letters of Charlotte there was nothing to suppress. I give them at large [...]']	['Preface']			['Authorship claim for a fictional character. The preface here is interesting because it acknowledges that The Sorrows of Young Werter was written by an author as opposed to being a true account, yet still makes a claim for these being the discovered letters of Charlotte, a fictional character in Werter']
163997	The history of Ophelia. Published by the author of David Simple. A new edition. Vol. I.	Fielding, Sarah	1787	['Author (text)']	['Proper name']	['Ophelia']	['Introduction']			['Authorship claim for a fictional character']
164001	Modern times, or the adventures of Gabriel Outcast. Supposed to be written by himself. In imitation of Gil Blas. In three volumes. Volume I. The third edition, with additions.	Trusler, John	1786	['Author (text)']	['Proper name']	['The adventures of Gabriel Outcast. Supposed to be written by himself. In imitation of Gil Blas.']	['Title Page']	['Male']	['Male']	['This author claim is a by a fictional character, the protagonist of the story.']
164282	Anna: or memoirs of a Welch heiress: interspersed with anecdotes of a nabob. In four volumes. Vol. I. The second edition corrected by the author.	Bennett	1786	['Author (text)']	['Generic/Descriptive']	['But, although I am equally sensible of the deficiencies of my trifling production, I beg leave to aver I am divested of every selfish inducement; even the reception of this first effort of my pen in the world [...]']	['Dedication']	['Indeterminate']	['Female']	
1746796	The adventures of Gil Blas of Santillane. A new translation, by the author of Roderick Random. Adorned with thirty-three cuts, neatly engraved. In four volumes. The fifth edition. Volume I.	Le Sage, Alain-RenÈ	1782	['Translator (text)']	['Reference to other works']	['A new translation, by the author of Roderick Random.']	['Title Page']	['Indeterminate']	['Male']	
1798428	The minor; or history of George O'Nial, esq. In two volumes. Vol. I.		1788	['Author (paratext)']	['Generic/Descriptive']	['I am, Sir, with great respect, your devoted and very humble servant, the author.']	['Dedication']	['Indeterminate']	['Unknown']	
1798766	The adventures of Anthony Varnish, or, A peep at the manners of society. By an Adept. In three volumes. Vol. I.	Johnstone, Charles	1786	['Author (paratext)']	['Generic/Descriptive']	['I am, sir, with great respect, your sincere admirer, and most obedient servant, the author.']	['Dedication']	['Indeterminate']	['Male']	
1799034	Julia de Gramont. By the right honorable Lady H****. In two volumes. Vol. I.	Hawke, Cassandra	1788	['Author (text)']	['Initials']	['By the right honorable Lady H****']	['Title Page']	['Female']	['Female']	
1800288	The amicable Quixote; or, the enthusiasm of friendship. In four volumes. Vol. I.		1788	['Author (text)']	['Generic/Descriptive']	['nothing but the experience of having frequently beheld new characters in new situations would induce me to present the following pages to the public.']	['Preface']	['Male']	['Unknown']	['Implicit gender claim: ""From the commendations of the ladies, for whom works of this kind are generally written, I hope to derive that sanction and encouragement [...]"']
190185	Henrietta. By Mrs. Lennox. In two volumes.	Lennox, Charlotte	1787	['Author (paratext)']	['Proper name']	["Madam, your grace's most obliged, and most devoted servant, Charlotte Lennox"]	['Dedication']	['Female']	['Female']	
208314	Excessive sensibility; or, the history of Lady St. Laurence. A novel. Vol. I.	Pigott, Harriet	1787	['Author (paratext)']	['Generic/Descriptive']	["I am, madam, your ladyship's most obedient, humble servant, the author."]	['Dedication']	['Indeterminate']	['Female']	
3136144	The travels of Lemuel Gulliver, into several remote nations of the world. Who was first a surgeon, and then a captain of several ships. In four parts.	Swift, Jonathan	1787	['Author (paratext)']	['Proper name']	['Mary Gulliver to Capt. Lemuel Gulliver.']	['Poem']	['Female']		['Fictional author claim.']
3441301	Guilliver revived: containing singular travels, campaigns, voyages, and adventures in Russia, the Caspian sea, Iceland, Turkey, Egypt, Gibraltar, up the Mediterranean, on the Atlantic Ocean, and through the centre of Mount Etna into the South Sea: also an account of a voyage into the moon and Dog-star, with many extraordinary particulars, relative to the cooking animal in those planets, whichare here called the human species. By Baron Munchausen. The fifth edition, considerably enlarged, and ornamented with explanatory views, engraved from original designs.		1788	['Editor (text)']	['Generic/Descriptive']	['The editor of these adventures humbly hopes they will also be received with the same marks of respect [...]']	['Preface']	['Indeterminate']	['Unknown']	
3445990	The life and opinions of Tristram Shandy, gentleman. Vol. I. A new edition.	Sterne, Laurence	1782	['Author (paratext)']	['Proper name']	["I am, my lord, your lordship's most devoted, and most humble servant, Laur. Sterne."]	['Dedication']	['Male']	['Male']	['From ""To the right honourable John Lord Viscount Spencer.""']
3450187	The Platonic guardian: or, history of an orphan.	A Lady	1788	['Author (text)']	['Generic/Descriptive']	['By a Lady.']	['Title Page']	['Female']	['Female']	
35225-1	Emmeline, the orphan of the castle. By Charlotte Smith. In four volumes. Vol. I.	Smith, Charlotte Turner	1788	['Author (text)']	['Proper name']	['By Charlotte Smith.']	['Title Page']	['Female']	['Female']	
35225-2	Emmeline, the orphan of the castle. By Charlotte Smith. In four volumes. Vol. I.	Smith, Charlotte Turner	1788	['Author (text)']	['Proper name']	['By Charlotte Smith.']	['Title Page']	['Female']	['Female']	
3768971	The adventures of Theagenes and Chariclea. A romance. Translated from the Greek of Heliodorus. Vol. I.	Heliodorus	1789	['Author (paratext)']	['Generic/Descriptive']	['I remember to have seen formerly an old English translation of this work; but I have no been able to procure it since I began my own:']	['Advertisement']	['Indeterminate']	['Unknown']	
3769976	Little truths better than great fables: containing information on divers subjects, for the instruction of children. Volume I. Illustrated with copper-plates.	Darton, William	1800	['Author (text)']	['Generic/Descriptive']	['In this view doth the author...behold the minds of infants. Having seen the great hurt of impressing false ideas on their minds...has induced him to submit the following sheets']	['Introduction']	['Male']	['Male']	
4785227	Heloise: or, the siege of Rhodes. A legendary tale. By the author of Maria: or, The generous rustic. Second edition. To which is added Harriet: or, The vicar's tale. In two volumes. Vol. I.	Berkeley, George Monck	1788	['Author (text)']	['Generic/Descriptive']	["Although the candour with which the author's former attempts have been received, [...]"]	['Preface']	['Male']	['Male']	
596561	Peruvian tales, related in one thousand and one hours, by one of select virgins of Cusco, to the Ynca of Peru, to dissuade him from a resolution he had taken to destroy himself by poison. Translated from the original French by Samuel Humphreys, Esq. In three volumes.	Gueullette, Thomas-Simon	1786	['Author (text)']	['Initials']	['In this continuation of the Peruvian tales, I have fully considered the weight of the subject for which they were principally designed, and have wrote in a familiar easy style, avoiding all terms of art, and have endeavoured to be every where intelligible. I wish they may produce a good effect, by bringing all those who shall peruse them into an abhorrence of of the sin of suicide, never to be repented of, and which it was their purpose to prevent. J.K.']	['Preface']	['Indeterminate']	['Male']	
88720	Original stories, from real life; with conversations, calculated to regulate the affections, and form the mind to truth and goodness.	Wollstonecraft, Mary	1788	['Author (text)']	['Generic/Descriptive']	['In writing the following work, I aim at perspicuity and simplicity of style']	['Preface']	['Indeterminate']	['Female']	
5942278	Harrison's edition. Letters from a Persian in England, to his friend at Ispahan. By George Lord Lyttelton.	Lyttelton, George Lyttelton	1785	['Translator (text)']	['Generic/Descriptive']	['Sir, I need not acquaint you by what accident these letters were put into my hands, and what pains I have taken in translating them']	['To the Bookseller']	['Male']		['Fictional translation claim']
1752858	The interesting narrative of the life of Olaudah Equiano, or Gustavus Vassa, the African. Written by himself. Fifth edition, enlarged.	Equiano, Olaudah	1792	['Author (paratext)']	['Proper name']	['[Signed,] I am, my lords and gentleman, your most obedient, and devoted humble servant, Olaudah Equiano, or Gustavus Vassa.']	['Dedication']	['Male']	['Male']	
102829	The life of Frederick, Baron Trenck. Written by himself, and translated from the German. Vol. I.	Trenck, Friedrich	1788	['Author (paratext)']	['Proper name']	['My adventures, and my conduct in the course of my life, are faithfully related, without the addition or omission of any circumstance.']	['Preface']	['Male']	['Male']	
ocn476765648	The adventures of a pin, supposed to be related by himself, herself, or itself.		1796	['Author (text)']	['Generic/Descriptive']	['by himself, herself, or itself.']	['Title Page']	['Indeterminate']		['Authorship claim is by a fictional inanimate object.']
ocm40688589 	Agnes; or, the triumph of principle.		1822	['Author (text)']	['Generic/Descriptive']	['It is not the hope of acquiring literary fame that has urged me to publish the following pages.']	['Preface']	['Indeterminate']		
ocn484442023	The fair Syrian, a novel. By the author of Mount Henneth and Barham Downs. In two volumes. Volume I.	Bage, Robert	1787	['Author (text)']	['Reference to other works']	['By the author of Mount Henneth and Barham Downs.']	['Title Page']	['Indeterminate']	['Male']	
ocm06756321 	Brambleton Hall, a novel, being a sequel to the celebrated expedition of Humphrey Clinker, by Tobias Smollet, M.D.		1818	['Author (text)']	['Proper name']	['By Tobias Smollet, M.D.']	['Title Page']	['Male']	['Male']	['The author mentioned on the title page is not the author of Brambleton Hall but of The celebrated expedition of Humphrey Clinker.']
ocm13313695 	Fitz of Fitz-ford; A legend of Devon. By Mrs. Bray, author of 'De Foix,' 'The White Hoods,' 'The Protestant,' &c. &c. &c.	Bray	1830	['Author (paratext)']	['Generic/Descriptive']	["[...]his grace's most obliged, and very faithful servant, the author."]	['Dedication']	['Indeterminate']	['Female']	['Same author as text.']
ocm40733633 	The power of sympathy: or, the triumph of nature. Founded in truth. In two volumes. Vol. I.	Brown, William Hill	1789	['Author (paratext)']	['Generic/Descriptive']	['By their humble servant, the author']	['Front']	['Indeterminate']	['Male']	['Transcription : These volumes[...] are inscribed, with esteem and sincerity, by their friend and humble servant, the author']
ocm02861722 	Discipline: a novel. By the author of ""Self-control.""	Brunton, Mary	1814	['Author (text)']	['Proper name']	['In the following pages, an attempt is made to amuse; with what success, the author has no means of judging.']	['Preface']	['Female']	['Female']	['But she has not confined her aim to conveying what is calculated innocent amusement.']
ocm06536542 	Self-control: a novel.	Brunton, Mary	1811	['Author (text)']	['Generic/Descriptive']	['In presenting to the public another edition of Self-Control, the author gratefully acknowledges the indulgence which her first literary attempt has received.']	['Advertisement']	['Female']	['Female']	
ocn486073979	Traits of nature, by Miss Burney, author of Clarentine, &c. In five volumes vol. I.	Burney, Sarah Harriet	1812	['Author (paratext)']	['Proper name']	['La Bruyere.']	['Title Page']	['Male']	['Male']	
ocm52981134 	Traits of nature, by Miss Burney, author of Clarentine, &c. In five volumes vol. I	Burney, Sarah Harriet	1813	['Author (text)']	['Proper name']	['by Miss Burney']	['Title Page']	['Female']	['Female']	
ocn480433456	The death of Cain, in five books. According to the manner of the death of Abel by Mr. Gessner.	Collyer, Mary	1813	['Author (text)']	['Generic/Descriptive']	['the author of the present little volume']	['Preface']	['Indeterminate']	['Unknown']	
ocn123448855	The express. A novel. In three volumes. By Frances D'Aubigne	Maintenon	1819	['Author (text)']	['Generic/Descriptive']	['the author of the folowing pages']	['Advertisement']	['Female']	['Female']	
