id	title	author	date	a	b	2	3	5	6	7
260496	Pleasure and pain, or the fate of Ellen; A novel. In three volumes. Anna Maria Weston. Vol. I.	Weston, Anna Maria	1814	['Author (text)']		['Anna Maria Weston']	['Title Page']	['Female']	['Female']	
260498	Rosanne; or, a father's labour lost. In three volumes. By Laetitia-Matilda Hawkins. Volume I.	Hawkins, Laetitia Matilda	1814	['Author (text)', 'Author (paratext)']	['Proper name']	['By Laetitia-Matilda Hawkins']	['Title Page']			
260500	Royal adventures: being the amorous history of King Henry the Eighth, and his court, &c. Wrote by a party in his pleasures; and now publish'd from the original papers, by a person of quality. Price one shilling	Orrery, Roger Boyle	1750	['Author (text)']		['Wrote by a party in his pleasures']	['Title Page']	['Indeterminate']		
260503	Secret memoirs and manners of several persons of quality of both sexes. From the new Atalantis an island in the Mediterranean. In four volumes. Written originally in Italian. Vol. I	Manley	1720	['Translator (text)']		['How vast must be the ambition of an unknown and meer translator to dare to hope from so great a prince, his most noble protection for so small a trifle? But he who enters not the lists, can never pretend to win the race...']	['Dedication']	['Male']		
260508	Tales of fancy, by S.H. Burney. Author of 'Clarentine,' 'Geraldine Fauconberg,' and 'Traits of nature. ' The shipwreck.	Burney, Sarah Harriet	1816	['Author (paratext)']		["Inscribed by her Royal Highness's most obedient, and most humble servant, Sarah Harriett Burney"]	['Dedication']	['Female']		
260658	St. Leon: a tale of the sixteenth century.  By William Godwin.  The third edition.  In four volumes.	Godwin, William	1816	['Author (text)']		['By William Godwin']	['Title Page']	['Male']	['Male']	
260660	The history of the adventures of Joseph Andrews, and his friend Mr. Abraham Adams. Written in imitation of the manner of Cervantes, author of Don Quixote. By Henry Fielding, Esq.	Fielding, Henry	1810	['Author (text)']	['Proper name']	['By Henry Fielding, Esq.']	['Title Page']	['Male']		
260662	Tales of the East:  comprising the most popular romances of oriental origin, and the best imitations by European authors: with new translations, and additional tales, never before published. To which is prefixed an introductory dissertation, containing an account of each work, and of its author, or translator, by Henry Weber, Esq.  In three volumes. Volume the first, containing the Arabian nights, and new Arabian nights' entertainments.	Weber, Henry William	1812	['Author (paratext)']	['Proper name']	['To which is prefixed an introductory dissertation, containing an account of each work, and of its author, or translator, by Henry Weber, Esq.']	['Title Page']	['Male']	['Unknown']	
260666	The modern Griselda. A tale. By Miss Edgeworth, author of The parent's assistant, Tales of fashionable life, Letters for literary ladies, Moral tales, &c. First American edition.	Edgeworth, Maria	1810	['Author (text)']		["By Miss Edgeworth, author of The parent's assistant,  Tales of fashionable life, Letters for literary ladies, Moral tales, &c."]	['Title Page']	['Female']		
260667		Edgeworth, Maria	1810	['Author (text)']		["By Miss Edgeworth, author of The parent's assistant,  Tales of fashionable life, Letters for literary ladies, Moral tales, &c."]	['Title Page']	['Female']		
260668		Bunyan, John	1810	['Author (paratext)']		["Mr. Bunyan's advertisement to the reader"]	['Advertisement']	['Male']	['Male']	
260669	The knight of St. John, a romance. By Miss Anna Maria Porter, author of ""The Recluse of Norway,"" &c. &c. &c. In three volumes. Vol. I.	Porter, Anna Maria	1817	['Author (paratext)']		['The following pages are inscribed, by their very grateful and affectionate -- Anna Maria.']	['Dedication']	['Female']	['Female']	
260671	The knight of St. John, a romance. By Miss Anna Maria Porter, author of ""The Recluse of Norway,"" &c. &c. &c. In two volumes. Vol. I.	Porter, Anna Maria	1817	['Author (paratext)']		['The following pages are inscribed, by their very grateful and affectionate -- Anna Maria.']	['Dedication']	['Female']	['Female']	
260673	Clarentine, a novel. By Miss Burney, Author of  ""Geraldine Fauconberg,"" ""Traits of nature,"" &c. Second edition. In Three volumes. Vol. I.	Burney, Sarah Harriet	1816	['Author (text)']	['Reference to other works']	['Author of  ""Geraldine Fauconberg,"" ""Traits of nature,"" &c.']	['Title Page']	['Indeterminate']	['Female"']	
260674	A journey to the world under-ground. By Nicholas Klimius. Translated from the original.	Holberg, Ludvig	1742	['Author (text)']	['Nicholas Klimius']	['By Nicholas Klimius']	['Title Page']	['Male']		
260682	The itinerant; or, memoirs of an actor. Second edition. In three volumes. Vol. I. By S.W. Ryley.	Ryley, S. W	1817	['Author (paratext)']		['The author.']	['Preface']	['Indeterminate']		
260684	The itinerant, or memoirs of an actor.  Vol. IV.  By S. W. Ryley.	Ryley, S. W	1816	['Author (paratext)', 'Author (text)']		['By S.W. Ryley']	['Title Page', 'Dedication']	['Indeterminate']	['Male']	
260686		Fielding, Sarah	1744	['Author (text)']		['By a lady.']	['Title Page']	['Female']		
260687	The adventures of David Simple: containing an account of his travels through the cities of London and Westminster, in the search of a real friend. By a lady. In two volumes. Vol. I. The second edition, revised and corrected. With a preface by Henry Fielding Esq;	Fielding, Sarah	1744	['Author (text)']	['Generic/Descriptive']	['By a lady.']	['Title Page']	['Female']		
260688	The adventures of David Simple: containing an account of his travels through the cities of London and Westminster, in the search of a real friend. By a lady. In two volumes. Vol. I. The second edition, revised and corrected. With a preface by Henry Fielding Esq;	Fielding, Sarah	1744	['Author (text)']	['Generic/Descriptive']	['By a lady.']	['Title Page']	['Female']		
260697	The life, adventures, and many and great vicissitudes of fortune of Simon, Lord Lovat, the head of the family of Frasers. From his birth at Beaufort, near Inverness, in the highlands of Scotland, in 1668, to the time of his being taken by Capt. Millar, after three days search, in a hollow tree, on the coasts of Knoidart and Arisaig. By the Rev. Archibald Arbuthnot, one of the society for propagating the Christian knowledge, and minister of Kiltarlaty, in the Presbytyry of Inverness.	Arbuthnot, Archibald	1746	['Author (text)']	['Proper name']	['By the Rev. Archibald Arbuthnot']	['Title Page']	['Male']		
260699	Familiar letters between the principal characters in David Simple, and some others. To which is added, a vision. By the author of David Simple. In two volumes. Vol. I.	Fielding, Sarah	1747	['Author (text)']	['Reference to other works']	['By the author of David Simple']	['Title Page']	['Indeterminate']		
260700	Clarissa. Or, the history of a young lady: comprehending the most important concerns of private life and particularly shewing, the distresses that may attend the misconduct both of parents and children, in relation to marriage. Published by the editor of Pamela. Vol. I.	Richardson, Samuel	1748	['Publisher (text)']		['Published by the editor of Pamela']	['Title Page']	['Indeterminate']		
260701	Clarissa. Or, the history of a young lady: comprehending the most important concerns of private life and particularly shewing, the distresses that may attend the misconduct both of parents and children, in relation to marriage. Published by the editor of Pamela. Vol. I.	Richardson, Samuel	1748	['Publisher (text)']		['Published by the editor of Pamela']	['Title Page']	['Indeterminate']		
260702	Secret histories, novels, and poems. Written by Mrs. Eliza Haywood. Vol. IV. Containing, I. The rash resolve: or, the untimely discovery. A novel. II. The masqueraders: or, fatal curiosity; being the secret history of a late amour. III. Lasselia: or, the self-abandon'd. A novel. IV. The force of nature: or, the lucky disappointment. A novel. The fourth edition.	Haywood, Eliza Fowler	1746	['Author (text)']	['Proper name']	['Written by Mrs. Eliza Haywood.']	['Title Page']	['Female']		
260703	Life's progress through the passions: or, the adventures of Natura.  by the author of the fortunate foundlings.	Haywood, Eliza Fowler	1748	['Author (text)']		['By the author of the fortunate foundlings']	['Title Page']	['Indeterminate']	['Female']	
260704	Life's progress through the passions: or, the adventures of Natura.  by the author of the fortunate foundlings.	Haywood, Eliza Fowler	1748	['Author (text)']		['By the author of the fortunate foundlings']	['Title Page']	['Indeterminate']	['Female']	
260706	The history of Tom Jones, a foundling. In six volumes. By Henry Fielding, Esq;	Fielding, Henry	1749	['Author (text)']	['Generic/Descriptive']	['An author ought to consider himself, not as a gentleman who gives a private or eleemosynary treat, but rather as one who keeps a public ordinary, at which all persons are welcome for their money.']	['Text']	['Male']	['Male']	['Fielding extensively uses the authorial first person and speculates on the nature of the novel.s']
260707	The history of Tom Jones, a foundling. Vol. VI. By Henry Fielding, Esq.	Fielding, Henry	1749	['Author (text)']		['By Henry Fielding, Esq.']	['Title Page']	['Male']		
260708	The history of Tom Jones, a foundling. Vol. VI. By Henry Fielding, Esq.	Fielding, Henry	1749	['Author (text)']	['Proper name']	['By Henry Fielding, Esq.']	['Title Page']	['Male']		
260709	The governess; or, little female academy. Being the history of Mrs. Teachum, and her nine girls. With their nine days amusement. Calculated for the entertainment and instruction of young ladies in their education. By the author of David Simple.	Fielding, Sarah	1749	['Author (text)']	['Reference to other works']	['By the author of David Simple.']	['Title Page']			
260712	The adventures of David Simple: containing an account of his travels through the cities of London and Westminster, in the search of a real friend. By a lady. In two volumes. Vol. I.	Fielding, Sarah	1744	['Author (text)']	['Generic/Descriptive']	['By a lady.']	['Title Page']	['Female']		
260713	The adventures of David Simple: containing an account of his travels through the cities of London and Westminster, in the search of a real friend. By a lady. In two volumes. Vol. I.	Fielding, Sarah	1744	['Author (text)']	['Generic/Descriptive']	['By a lady.']	['Title Page']	['Female']		
260715	Miscellanies by Henry Fielding Esq; in three volumes.	Fielding, Henry	1743	['Author (text)']	['Proper name']	['Miscellanies by Henry Fielding, Esq.']	['Title Page']	['Male']		
260719	The history of a fair Greek, who was taken out of a seraglio at Constantinople, and brought to Paris by a late ambassador at the Ottoman Port: interspersed with the surprising adventures of several other slaves. By Abbot Provost. Almoner to his serene highness the Prince of Conti. Vol. I.	PreÃÅvost, abbeÃÅ	1741	['Author (text)']		['By Abbot Provost, almoner to his serene highness the Prince of Conti.']	['Title Page']	['Male']		
260720	The history of the adventures of Joseph Andrews, and his friend Mr. Abraham Adams. Written in imitation of the manner of Cervantes, author of Don Quixote. By Henry Fielding, Esquire. The third edition, illustrated with cuts. In two volumes. Vol. II.	Fielding, Henry	1743	['Author (text)']	['Proper name']	['By Henry Fielding, Esq.']	['Title Page']	['Male']		
260723	Melmoth House: a novel. In three volumes, by Mrs. J. Jenner. Vol. I.	Jenner, J.	1816	['Author (text)']		['In three volumes, by Mrs. J. Jenner']	['Title Page']	['Female']		
260724	The Polite Correspondence: Or, Rational Amusement; Being a Series of Letters, Philosophical, Poetrical, Historical, Critical, Amorous, Moral, and Satyrical. Wherein are introduc'd a great Variety of instructive and delightful incidents, both in  Profe and Verfe.	Campbell, John	1740	['Author (paratext)']	['Generic/Descriptive']	["I am, May it pleafe your Grace, Your Grace's moft Humble and moft devoted Servant, The Author."]	['Dedication']	['Indeterminate']	['Unknown']	
260726	The Messiah: Attempted from the German of Mr. Klopstock. By Joseph Collyer. In Fifteen Books. Two Vols. Vol. I.	Klopstock, Friedrich Gottlieb	1811	['Translator (patatext)']	['Generic/Descriptive']	["Translator's Preface"]	['Preface']	['Indeterminate']	['Male']	
260727	The messiah: From the German of Klopstock. The first sixteen books by Mrs. Collver, and the three last by Mrs. Meeke. To which is prefixed, an introduction on divine poetry. In two volumes. Vol. II.	Klopstock, Friedrich Gottlieb	1811	['Author (text)']		['First sixteen books by Mrs. Collyer, and the three last by Mrs. Meeke.']	['Title Page']	['Female']		
260729	The adventures of Ferdinand Count Fathom. By Dr. Smollett, author of Roderick Random; Peregrine Pickle, &c. &c. In two volumes. Vol. I.	Smollett, Tobias George	1817	['Author (text)']	['Generic/Descriptive']	['Your very affectionate friend and servant, THE AUTHOR.']	['Dedication']	['Male']	['Male']	
260732	The Brownie of Bodsbeck; and other tales. By James Hogg, author of ""The Queen's Wake,"" &c. &c. In Two Volumes. Vol. I.	Hogg, James	1818	['Author (paratext)']	['Initials']	['J.H.']	['Dedication']	['Indeterminate']	['Male']	
260734	The captivity and deliverance of Mr. John Williams, pastor of the church in Deerfield, and Mrs. Mary Rowlandson, of Lancaster, who were taken, together with their families and neighbors, by the French and Indians, and carried into Canada. Written by themselves.	Williams, John	1811	['Author (paratext)']	['Generic/Descriptive']	["Your excellency's most humble, obedient, and dutiful servant, John Williams."]	['Dedication']	['Male']		
260735	Self-control: a novel. Volume I.	Brunton, Mary	1811	['Author (paratext)']	['Generic/Descriptive']	['Madam, Your obedient Servant, The Author']	['Dedication']	['Indeterminate']	['Female']	
260736	The alderman and the peer; or, the ancient castle & modern villa. In three volumes. By Miss Byron, author of The Englishwoman, Hours of affluence and Days of indigence, &c. Vol. I.	Byron, Medora Gordon	1810	['Author (text)']		['By Miss Byron, author of The Englishwoman, Hours of affluence and Days of indigence, &c.']	['Title Page']	['Female']	['Female']	
260740	Discipline: a novel.  By the author of ""Self-control."" Volume I.	Brunton, Mary	1814	['Author (text)']		['By the author of ""Self-control""']	['Title Page']	['Indeterminate']	['Female"']	
260743	A world without souls, and the velvet cushion by J.W. Cunningham, A.M. Vicar of Harrow	Cunningham, J. W	1815	['Author (paratext)']	['Generic/Descriptive']	['""t has seemed right to the Author to meet the increased demand for this little work, by the publication of another edition...""']	['Preface (a world without souls)']	['Male"']		
260745	An interesting account of the voyages and travels of Captains Lewis and Clarke, in the years 1804-5, & 6.  Giving a faithful description of the river Missouri and its source--of the various tribes of Indians through which they passed--manners and customs--soil--climate--commerce--gold and silver mines--animal and vegetable productions: interspersed with very entertaining anecdotes, and a variety of other useful and pleasing information, remarkably calculated to delight and instruct the readers. To which is added a complete dictionary of the Indian tongue.  By William Fisher, Esq.		1813	['Author (text)']		['By William Fisher, Esq.']	['Title Page']	['Male']	['Unknown']	
260747	Alicia de Lacy; an historical romance. By the author of ""The loyalists, "" &c. In four volumes.  Vol. I.	West	1814	['Author (text)']		['By the author of ""The Loyalists,"" &c.']	['Title Page']	['Indeterminate']	['Female"']	
260755	The coquette; or, the history of Eliza Wharton. A novel: founded on fact. By a lady of Massachusetts. Third edition. Published according to Act of Congress.	Foster, Hannah Webster	1811	['Author (text)']	['Generic/Descriptive']	['By a lady of Massachusetts']	['Title Page']	['Female']		
260757	Elfrida, heiress of Belgrove. A novel, in four volumes.  By Emma Parker. Vol. I.	Parker, Emma	1811	['Author (text)']	['Proper name']	['By Emma Parker.']	['Title Page']	['Female']		
260758		Rose, Edward H	1811	['Author (text)']		['By Edward Rose, seaman']	['Title Page']	['Male']		
260759	The messiah: From the German of Klopstock. The first sixteen books by Mrs. Collver, and the three last by Mrs. Meeke. To which is prefixed, an introduction on divine poetry. In two volumes. Vol. I.	Klopstock, Friedrich Gottlieb	1811	['Author (text)']		['First sixteen books by Mrs. Collyer, and the three last by Mrs. Meeke.']	['Title Page']	['Female']		
260760	Think's-I-to-myself. A serio-ludicro, tragico-comico tale, written by Think's-I-to-myself who?  In two volumes.  Vol. I.	Nares, Edward	1811	['Author (text)']		["Written by Think's-I-to-myself who?"]	['Title Page']	['Indeterminate']	['Male']	
260761	Think's-I-to-myself. A serio-ludicro, tragico-comico tale, written by Think's-I-to-myself who?  In two volumes.  Vol. I.	Nares, Edward	1811	['Author (text)']		["Written by Think's-I-to-myself who?"]	['Title Page']	['Indeterminate']	['Male']	
260762	The refusal. By the author of the ""Tale of the times,"" ""Infidel father,"" &c. Vol. I.	West	1810	['Author (text)']		['Works written by Mrs. West.']	['Advertisement']	['Female']		
260763	A tale of a tub, written for the universal improvement of mankind. To which is added, an account of a battle between the ancient and modern books in st. James's Library. With the author's apology, and explanatory notes, by W. Wotton, B.D. and others.	Swift, Jonathan	1811	['Author (text)']	['Generic/Descriptive']	['the author tells us in his preface to the first treatise']	['To the reader']	['Male']	['Unknown']	
260774	The old manor house, a novel, by Charlotte Smith.  a new edition, in two volumes. Vol. I.	Smith, Charlotte Turner	1810	['Author (text)']		['By Charlotte Smith']	['Title Page']	['Female']	['Female']	
260775	Forest of Montalbano: a novel.  In four volumes.  By the author of ""Santo Sebastiano,"" and ""The Romance of the Pyrenees.""   Vol. I.	Cuthbertson, Catherine	1810	['Author (text)']		['By the author of ""Santo Sebastiano,"" and ""The Romance of the Pyrenees.""']	['Title Page']	['Indeterminate']	['Female"']	
260776	Anne of Brittanny: an historical romance.  In three volumes. Vol. I.		1810	['Author (text)']	['Generic/Descriptive']	['THE AUTHOR']	['Preface']	['Indeterminate']	['Unknown']	
260777	Julia de Vienne. A novel. In four volumes. Imitated from the French, by a lady. Vol. I.	A Lady	1811	['Author (text)']	['Generic/Descriptive']	['By a lady']	['Title Page']	['Female']		
260783	Mansfield park: a novel.  in three volumes.  By the author of ""Pride and prejudice."" Vol. I. Second edition.	Austen, Jane	1816	['Author (text)']		['By the author of ""Pride and prejudice""']	['Title Page']	['Indeterminate']	['Female"']	
260786	Frankenstein; or, The modern Prometheus. In three volumes. Vol. I.	Shelley, Mary Wollstonecraft	1818	['Author (text)']	['Author (paratext)']	['These volumes are respectfully inscribed by the author']	['Dedication']	['Indeterminate']	['Female']	
260788	Tales from Shakespeare, designed for the use of young persons. By Charles Lamb. In two volumes. Vol. I.	Lamb, Charles	1813	['Author (text)']		['By Charles Lamb.']	['Title Page']	['Male']		
260790	Shakespeare's jest book.		1814	['Author (paratext)']		['The editor.']	['To the reader']	['Indeterminate']		
260795	Tales of my landlord, third series, collected and arranged by Jedediah Cleishbotham, schoolmaster and parish-clerk of Gandercleugh. In four volumes. Vol. I.	Scott, Walter	1819	['Editor (text)']		['collected and arranged by Jedediah Cleishbotham, schoolmaster and parish-clerk of Gandercleugh']	['Title Page']	['Male']	['Male']	
260799	The Scottish chiefs, a romance. In five volumes. By Miss Jane Porter, author of Thaddeus of Warsaw, and remarks on Sidney's aphorisms. Second edition. Vol. I.	Porter, Jane	1811	['Author (text)']		["By Miss Jane Porter, author of Thaddeus of Warsaw, and remarks on Sidney's aphorisms."]	['Title Page']	['Female']	['Female']	
260800	The spirit of ""the book;"" or, memoirs of Caroline Princess of Hasborough, a political and amatory romance. In three volumes. Vol. I. Edited by Thomas Ashe, Esq.		1811	['Editor (text)']		['Edited by Thomas Ashe, Esq.']	['Title Page']	['Male']	['Male']	
260807	The heroine, or adventures of Cherubina, by Eaton Stannard Barrett, Esq.  Third edition.  In three volumes.  Vol. I.	Barrett, Eaton Stannard	1815	['Author (text)']		['By Eaton Stannard Barrett, Esq.']	['Title Page']	['Male']		
260813	The history of Tom Jones, a foundling. Vol. IV. By Henry Fielding, Esq.	Fielding, Henry	1749	['Author (text)']	['Proper name']	['By Henry Fielding, Esq.']	['Title Page']	['Male']		
260818	The adultress; or, anecdotes of two noble families. A tale. In four volumes. By an english-woman. Vol. I.		1810	['Author (paratext)']	['Generic/Descriptive']	['An english-woman.']	['Preface']	['Female']	['Unknown']	
260822	The life and advenutres of Peter Wilkins, a Cornish man: taken from his own mouth, in his passage to England, from off Cape Horn in America, in the ship Hector.  By R.S., a passenger in the Hector.  In two volumes.  Vol. I.  A new edition, embellished with engravings.	Paltock, Robert	1816	['Author (paratext)']		["Madam, your ladyship's most obliged and most obedient servant, -- R.P."]	['Title Page']	['Indeterminate']		
260826	Rhoda: A Novel. By the Author of ""Things by their right names,"" ""Plain sense,"" &c. Second Edition. In three volumes. Vol. I.	Jacson, Frances	1816	['Author (text)']	['Reference to other works']	['Author of ""Things by their right names,"" ""Plain sense,"" &c.']	['Title Page']	['Indeterminate']	['Female"']	
260827	Charenton; or, the follies of the age: A philosophical romance. By M. De Lourdoueix. Translated from the french.	De Lourdoueix, M	1818	['Translator (paratext)']	['Generic/Descriptive']	["Translator's Preface"]	['Preface']	['Indeterminate']	['Unknown']	
260833	Rob Roy. By the Author of ""Waverley,"" ""Guy Mannering,"" and ""The Antiquary."" In three Volumes. Vol. I.	Scott, Walter	1818	['Author (text)']	['Reference to other works']	['the Author of ""Waverley,"" ""Guy Mannering,"" and ""The Antiquary.""']	['Title Page']	['Indeterminate']	['Male"']	
260834	Rob Roy. By the Author of ""Waverley,"" ""Guy Mannering,"" and ""The Antiquary."" In three Volumes. Vol. I.	Scott, Walter	1818	['Author (text)']	['Reference to other works']	['the Author of ""Waverley,"" ""Guy Mannering,"" and ""The Antiquary.""']	['Title Page']	['Indeterminate']	['Male"']	
260843		Roche, Regina Maria	1815	['Author (text)']	['Reference to other works']	['Author of ""London Tales,"" or ""Reflective Portraits,"" ""The Moor,"" ""Plain Tales;"" &c.']	['Title Page']	['Indeterminate']	['Female"']	
260852	Six Weeks at Long's. By a late resident. Second edition. In three volumes. Vol. I.	Barrett, Eaton Stannard	1817	['Author (text)']	['Generic/Descriptive']	['Printed for the author']	['Title Page']	['Indeterminate']	['Male']	
260858	The Scottish Adventurers, or, The Way to Rise; An historical tale. By Hector Macneill, Esq. In Two Volumes. Vol. I.	Macneill, Hector	1812	['Author (paratext)']	['Generic/Descriptive']	['I remain, My Dear Sir, Yours most faithfully, THE AUTHOR.']	['Dedication']	['Indeterminate']	['Male']	
260864	The travels and adventures of Mademoiselle de Richelieu. Cousin to the present Duke of that name. Who made the tour of Europe, dressed in men's cloaths, attended by her maid Lucy as her valet de chambre. Now done into English from the Lady's own manuscript. By the translator of the memoirs and adventures of the Marques of Bretagne and Duke of Harcourt. Vol. I.	Erskine	1744	['Translator (text)']	['Generic/Descriptive']	['By the translator of the memoirs and adventures of the Marques of Bretagne and Duke of Harcourt']	['Title Page']	['Indeterminate']		
260869	The British novelists: with an essay; and prefaces, biographical and critical, by Mrs. Barbauld. Vol. I.	Richardson, Samuel	1810	['Author (text)']		['A new edition, with the last corrections by the author.']	['Title Page']	['Indeterminate']	['Male']	
260870	The British novelists; with an essay; and prefaces, biographical and critical. By Mrs. Barbauld. Vol. XIV.	Richardson, Samuel	1810	['Author (text)']	['Proper name']	['By Mr. Samuel Richardson, author of Pamela and Clarissa.']	['Title Page']	['Male']		
260871	The British novelists; with an essay; and prefaces, biographical and critical. By Mrs. Barbauld. Vol. XVI.	Defoe, Daniel	1810	['Author (text)']		['Written by himself']	['Title Page']	['Male']		
260872	The British novelists: with an essay; and prefaces, biographical and critical, by Mrs. Barbauld. Vol. XVIII.	Fielding, Henry	1810	['Author (text)']		['By Henry Fielding, Esq.']	['Title Page']	['Male']	['Male']	
260873	The British novelists: with an essay; and prefaces, biographical and critical, by Mrs. Barbauld. Vol. XIX.	Fielding, Henry	1810	['Author (text)']	['Proper name']	['By Henry Fielding, Esq.']	['Title Page']	['Male']	['Male']	
260874	The old English Baron. A gothic story. The  castle of Otranto. A gothic story. By Horace Walpole. Earl of Orford	Reeve, Clara	1810	['Author (text)']		['By Horace Walpole, Earl of Orford']	['Title Page']	['Male']	['Male']	
260875	The British novelists; with an essay; and prefaces, biographical and critical. By Mrs. Barbauld. Vol. XXIII.	Coventry, Francis	1810	['Author (text)']		['By Dr. Goldsmith.']	['Title Page']	['Male']		
260876	The British novelists; with an essay; and prefaces, biographical and critical. By Mrs. Barbauld. Vol. XXIIII.	Lennox, Charlotte	1810	['Author (text)']		['By Mrs. Lennox']	['Title Page']	['Female']	['Female']	
